id,category,skill,definition,definition_link
1,Pre-clinical,"Absorption, distribution, metabolism, elimination (ADME)","The key factors affecting the concentration and distribution of a drug within the body and the time it spends in the body. Drug activity depends on engagement between a drug and its molecular target. How a drug is absorbed, distributed across different tissues (or ‘compartments’), metabolized and eliminated (e.g. excreted) will all affect its ability to access its target site and have a biological effect. ADME are the core elements of pharmacokinetics.",https://revive.gardp.org/resource/absorption-distribution-metabolism-elimination-adme/
2,Clinical,Active pharmaceutical ingredient (API),"The chemical component of a drug treatment that is biologically active. In addition to an API, drug formulations may include a range of other biologically inactive materials, for example, to promote stability or to facilitate the manufacture of tablets or liquid medicines.",https://revive.gardp.org/resource/active-pharmaceutical-ingredient-api/
3,Clinical,Adaptive trial,"A clinical trial that can be modified mid-way through based on preliminary analysis of results. Adaptive trials are efficient ways of testing more than one drug at a time, or different doses of a drug. If initial data suggest that a treatment is not working, or is inferior to a comparator, recruitment into that treatment arm can be halted. Adaptive trials were pioneered in oncology but are increasingly being used in other areas of medicine.",https://revive.gardp.org/resource/adaptive-trial/
4,Pre-clinical,Ames test,"A method for evaluating the mutagenic effects of a compound or drug, used as part of toxicity testing. The test chemical is applied to a bacterial strain that has a mutation which renders it dependent on histidine for growth, along with a rat liver extract (to explore the potential for enzymatic processing of the chemical into a mutagenic form). After culture, the number of colonies that can grow in the absence of histidine, due to reversion of the mutation, provides a measure of the mutagenic potential of the chemical. There is a reasonable degree of correlation between mutagenicity as judged by the Ames essay and carcinogenicity in animal models. However, it is a screening tool with limited predictability when used without other assays.",https://revive.gardp.org/resource/ames-test/
5,Discovery,"Antimicrobial susceptibility testing (AST), resistance testing","Assessing the concentration of a drug, chemical or other substance required to inhibit microbial growth or to kill a microbe. Through bodies such as the European Committee on Antimicrobial Susceptibility Testing (EUCAST) and the Clinical and Laboratory Standards Institute (CLSI), internationally agreed standards have been developed to guide rigorous assessment of antimicrobial susceptibility.",https://revive.gardp.org/resource/antimicrobial-susceptibility-testing-ast-resistance-testing/
6,Discovery,Bacterial efflux,"Bacterial efflux describes a process where molecules are pumped from inside bacterial cells to outside. This is done by molecular machines called efflux pumps. These are found in the membrane of bacterial cells and they are very important because they contribute to antimicrobial resistance. Many antibiotics work by getting inside bacterial cells where they interact with a specific target. Efflux pumps are able to physically pump those antibiotic molecules back out of the cell again which keeps the intracellular concentration below toxic levels meaning bacteria can survive at higher concentrations of the drug.",https://revive.gardp.org/resource/bacterial-efflux/
7,Discovery,Bacterial target,"A molecule in the bacterial cell that has a critical cellular function and can be altered or inhibited by an antimicrobial to negatively impact its’s growth or survival.",https://revive.gardp.org/resource/bacterial-target/
8,Clinical,Beta-lactamase,"Bacterial enzyme that hydrolyses and inactivates beta-lactam antibiotics, leading to antibiotic resistance. Beta-lactamases target the four-atom beta-lactam ring found in beta-lactam antibiotics. In the most used classification system, Ambler classification, beta-lactamases are grouped into four classes (A–D) based on amino acid sequence homologies. Ambler class A beta-lactamases include enzymes that are active on extended-spectrum cephalosporins (extended-spectrum beta-lactamases, ESBLs). Ambler class B enzymes rely on zinc for their activity and are also known as metallo-beta-lactamases. Ambler class D beta-lactamases were originally known as oxacillinases, owing to their rapid action on oxacillin, and are also known as OXA beta-lactamases. OXA enzymes have emerged as an important cause of carbapenem resistance, initially in Acinetobacter baumannii. OXA-type ESBLs have since spread to other bacterial families, including Enterobacteriaceae.",https://revive.gardp.org/resource/beta-lactamase/
9,Clinical,Biologics license application (BLA),"A request to the US Food and Drug Administration (FDA) for permission to market a new biologic product. Formally, a BLA is defined as a request for “permission to introduce, or deliver for introduction, a biologic product into interstate commerce in the US”. A BLA is broadly equivalent to a new drug application (NDA) for traditional small-molecule drugs. It should contain all the information needed to demonstrate the product’s safety, potency and purity.",https://revive.gardp.org/resource/biologics-license-application-bla/
10,Clinical,Bloodstream infection (BSI),"An infection of the blood that is circulated around the body. Blood is normally a sterile environment. Microbes from other parts of the body or the external environment can gain access to and multiply within blood. Bloodstream infections can be life threatening. An immune response to bacteria in the bloodstream can lead to sepsis, characterized by fever and low blood pressure, and if untreated multiple organ failure and death. Bloodstream infections are e responsible for high levels of morbidity and mortality. Many different types of microorganisms can establish bloodstream infections, and there is considerable variation in causative microorganisms in different parts of the world. Invasive medical procedures increase the risk of bloodstream infections, and so are common hospital-acquired infections. Bloodstream infections may be caused by drug-resistant microorganisms, and rising numbers of Gram-negative bacterial bloodstream infections are of great concern as these can be difficult to treat.",https://revive.gardp.org/resource/bloodstream-infection-bsi/
11,Clinical,Candidate,"A compound with strong therapeutic potential whose activity and specificity have been optimized. Hits obtained by high-throughput screening have potential to become antibiotic drugs. Their antibacterial properties must be confirmed, and their structure may need to be modified to maximize their activity or other properties that will make them suitable to be used as drugs. At the end of this process, the resulting compound is considered a ‘candidate’ and potentially suitable for clinical trials.",https://revive.gardp.org/resource/candidate/
12,Clinical,"Chemistry, manufacturing and controls (CMC)","Chemistry, manufacturing and controls; also referred to as pharmaceutical quality/CMC. The term covers the various procedures used to assess the physical and chemical characteristics of drug products, and to ensure their quality and consistency during manufacturing. CMC data are an important part of submissions to regulatory authorities.",https://revive.gardp.org/resource/chemistry-manufacturing-and-controls-cmc/
13,Clinical,"Clearance, renal","Removal of a substance from the body by the kidney and its excretion in urine. In pharmacologic terms, it is a pharmacokinetic measurement of the volume of plasma from which a substance is completely removed per unit time. Renal clearance is the principal route through which most drugs are removed from the body. Dosing of antibiotics may need to be adjusted in people with impaired renal function, as some antibiotics are toxic at high concentrations.",https://revive.gardp.org/resource/clearance-renal/
14,Clinical,Clinical Development,"Testing of a new drug or treatment in people. Early stages of drug discovery and development involve in vitro studies and work on animal models. After this preclinical phase, promising drugs enter clinical development, which typically involves three distinct phases of clinical trials: Phase 1: first use in human volunteers, to assess safety and pharmacokinetics Phase 2: first testing in patients, to check safety, provisional efficacy, and to test different doses Phase 3: efficacy testing in a larger number of patients",https://revive.gardp.org/resource/clinical-development/
15,Clinical,Clinical study report (CSR),"Comprehensive report of an individual study conducted in patients of any therapeutic, prophylactic, or diagnostic agent. A CSR must include an explanation of critical design features of the study, methods and how the study was carried out, individual patient data, and details of analytical methods. The content of CSRs is specified in guideline E3 produced by the International Conference on Harmonisation of Technical Requirements for Registration of Pharmaceuticals for Human Use (ICH). They are submitted to regulatory authorities and ethics committees and are a key element of submissions for regulatory approval.",https://revive.gardp.org/resource/clinical-study-report-csr/
16,Clinical,"Dosing: BID, TID","BID: bis in die, twice a day; TID: ter in die: three times a day. The appropriate dosing regimen for a drug depends on exposure-response relationships and is based on in vitro, in vivo, and clinical evidence. Depending on the drug class and its pharmacokinetic and pharmacodynamic properties, different dosing regimens may be optimal, including once a day (omne in die, OD), twice a day (bis in die, BID) or three times a day (ter in die, TID).",https://revive.gardp.org/resource/dosing-bid-tid/
17,Clinical,"Drug product, medicinal product","The final form of a medicinal product, such as a tablet, pill or liquid medicine. A drug product includes an active pharmaceutical ingredient, often (but not always) in association with other active or inactive ingredients.",https://revive.gardp.org/resource/drug-product-medicinal-product/
18,Discovery,Efflux-mediated resistance,"Resistance to antibiotics related to the presence of pumps that pump antibiotic molecules from the inside of the bacterial cell to the outside. Structurally and mechanistically diverse efflux pumps in the cell envelope play an important role in both intrinsic and acquired drug resistance.",https://revive.gardp.org/resource/efflux-mediated-resistance/
19,Clinical,Eligibility criteria (inclusion/exclusion),https://revive.gardp.org/resource/eligibility-criteria-inclusion-exclusion/
20,Clinical,"Endpoint, clinical trial","The principal outcome that is measured in a clinical trial. Clinical trials typically assess multiple endpoints. The primary endpoint relates specifically to the anticipated clinical impact of an intervention, such as cure or survival, to provide a measure of its efficacy. Secondary endpoints can provide additional information on the effects of an intervention and on mechanisms of action, as well as on possible specific safety issues. Exploratory endpoints cover clinical outcomes likely to be rare or measures that allow hypotheses to be tested. It is essential that endpoints are selected that provide a reliable assessment of the benefits of an intervention and hence its efficacy. They must be acceptable to all stakeholders, particularly regulatory authorities, which must have confidence in the validity and reliability of endpoints to approve new treatments.",https://revive.gardp.org/resource/endpoint-clinical-trial/
21,Clinical,Extensively drug-resistant (XDR),"Non-susceptibility to at least one agent in all but one or two antimicrobial categories (i.e. bacterial isolates remain susceptible to drugs from at most two classes of antibiotic). XDR organisms are resistant to more drugs than multidrug-resistant (MDR) microbes and often require use of relatively toxic drugs, high doses of drugs or drug combinations. Acquisition of additional resistance mechanisms has the potential to turn them into pandrug-resistant (PDR) organisms, resistant to all available antibiotics.",https://revive.gardp.org/resource/extensively-drug-resistant-xdr/
22,Clinical,First-in-human (FIH),"Synonym: first-in-man (FIM), First study of a novel intervention in humans. First-in-human studies are usually carried out in healthy volunteers. Their principal role is to assess the safety of new interventions. They may incorporate a dose-escalation study design (single ascending dose or SAD study) to identify the optimum dose for use in future trials. First-in-human studies are also used to gather data on the effects of a new drug in humans and how it is metabolized. First-in-human studies are phase 1 trials.",https://revive.gardp.org/resource/first-in-human/
23,Clinical,Good clinical practice (GCP),"Internationally agreed ethical and scientific quality standards for designing, conducting, recording, and reporting studies that involve human participants. Adherence to Good Clinical Practice ensures that the rights, safety, and wellbeing of participants are respected and protected, and that clinical trial data are reliable. Compliance with Good Clinical Practice is generally a legal obligation for all studies of investigational medical products involving human participants.",https://revive.gardp.org/resource/good-clinical-practice/
24,Pre-clinical,Good Laboratory Practice (GLP),"A quality assurance system to ensure the uniformity, consistency, reliability, reproducibility, quality and integrity of data from non-clinical studies to be submitted to regulatory authorities. Compliance with Good Laboratory Practice standards is essential for laboratory data to be accepted by regulatory authorities in regulatory submissions.",https://revive.gardp.org/resource/good-laboratory-practice-glp/
25,Clinical,Good Manufacturing Practice (GMP),"A quality assurance system for manufacturers to ensure that their products are consistently high in quality from batch to batch. Good Manufacturing Practice guidelines are designed to ensure the safety and activity of manufactured pharmaceutical products. Global standards have been developed by the International Conference on Harmonization (ICH) and the World Health Organization. Enforcement is the responsibility of national regulatory authorities.",https://revive.gardp.org/resource/good-manufacturing-practice-gmp/
26,Discovery,Gram-positive/negative,"Characterization of bacteria according to their appearance after Gram staining, which reflects differences in the structure of their cell walls. The cell envelopes of most bacteria fall into one of two major groups. In addition to a cytoplasmic/inner membrane, Gram-negative bacteria have a thin peptidoglycan cell wall and an outer membrane containing lipopolysaccharide. Between the two membranes is the periplasm where enzymes such as beta-lactamases are found. Gram-positive bacteria lack an outer membrane but have a much thicker peptidoglycan layer than Gram-negative organisms. There is no periplasm and enzymes e.g., beta-lactamases are excreted to the outside of the cell. This distinction has important implications for antibiotic development. Many antibiotics target proteins involved in cell wall biosynthesis so have to traverse the outer membrane and periplasm in Gram-negative bacteria. Hence, the complex cell envelope of Gram-negative bacteria presents a significant barrier to the entry of antibiotics into the cell. Gram-negative bacteria include many multidrug-resistant species, including all three of the highest priorities in the WHO priority pathogen list for R&D of new antibiotics.",https://revive.gardp.org/resource/gram-positive-negative/
27,Discovery,High-throughput screen (HTS),"The process by which large numbers of natural product extracts or chemicals (compound libraries) are tested for antimicrobial activity using automated and/or robotic equipment. High-throughput screens can either test the ability of compounds to inhibit a specific bacterial target or, more generally, to inhibit the growth of bacterial cells (see: ‘bacteriostatic‘) or kill bacteria (see: ‘bactericidal‘). Compounds discovered to have antibacterial activity in initial screens are known as ‘hits’.",https://revive.gardp.org/resource/high-throughput-screen-hts/
28,Discovery,"Hit confirmation, hit validation","Evaluation of a compound discovered to have antibacterial properties (a hit), by confirming its ability to inhibit bacterial growth, assessing its binding to molecular targets of interest, and determining its chemical structure. Hit validation is essential for eliminating false-positives from high-throughput screens, demonstrating that a compound has the potential to be an effective treatment, with no obvious chemical features that would make it difficult to develop into a drug.",https://revive.gardp.org/resource/hit-confirmation-hit-validation/
29,Discovery,"Hit identification, hit discovery","Testing for compounds that have antibacterial properties (hits), for example by high-throughput screening of compound libraries. Hits are an important starting point in drug discovery and development. However, they may require considerable chemical modification to enhance their antibacterial activity and other properties. Very few initial hits become antibiotics licensed to treat infections.",https://revive.gardp.org/resource/hit-identification-hit-discovery/
30,Discovery,"Hit-to-lead (HTL), lead generation","A stage of drug discovery during which a compound demonstrated to have antibacterial properties (a hit) is iteratively modified to improve its efficacy and other properties. Typically, multiple chemical variants of a hit compound are synthesized (hit expansion). Studies of these compounds help to identify key structural features of the compound associated with binding to molecular targets and efficacy (structure–activity relationships). Chemical modifications are also introduced to improve its drug-like properties, such as stability, membrane permeability, cytotoxicity and specificity. This stage ends with one or more optimized lead compounds that are extensively evaluated for efficacy and safety in biochemical and cellular assays and in animal studies.",https://revive.gardp.org/resource/hit-to-lead-htl-lead-generation/
31,Clinical,Informed consent,"Agreement from a potential participant that he or she is willing to take part in a clinical study and is aware of what the study involves. The principle of informed consent ensures that participants willingly take part in clinical studies and are fully aware of what the studies involve. To give informed consent, a potential participant must have received sufficient information in a format that enables them to understand the implications of their decision, and they must have sufficient reasoning powers to interpret the information provided. Special procedures are applied for those unable to give informed consent, for example, because of age, a decline in cognitive abilities or severe illness.",https://revive.gardp.org/resource/informed-consent/
32,Clinical,Intra-abdominal infection (IAI),"A group of infections that occur within the abdominal cavity. IAIs are a common cause of gastrointestinal emergency procedures and responsible for high levels of morbidity and mortality. An uncomplicated IAI (uIAI) involves only a single organ and does not extend to the peritoneum, a two-layer membrane that lines the abdominal cavity. A complicated IAI (cIAI) involves more than one organ and infection of the peritoneal space, the gap between the two layers of the peritoneum, leading to abscesses or peritonitis. Gram-negative and Gram-positive bacteria can cause IAIs and these can be drug-resistant.",https://revive.gardp.org/resource/intra-abdominal-infection-iai/
33,Clinical,Investigational medicinal product (IMP),"Any medicinal product that is being tested or used as a reference in a clinical trial. IMPs include newly developed drugs but also licensed drugs that are being tested against a new condition, or in a new formulation or packaging, or are being used to gather more information about the authorised form. Regulatory authorities mandate specific procedures for manufacturing and handling of IMPs, to ensure their quality and safety and hence the validity of clinical trial data.",https://revive.gardp.org/resource/investigational-medicinal-product-imp/
34,Clinical,Investigational new drug (IND),"A novel drug, ready to be tested for safety and efficacy in people. Before a new drug or biological product can be tested on people in the USA, an Investigational New Drug (IND) application must be made to the US Food and Drug Administration (FDA). An IND application must include information on safety in animal models, on manufacturing processes and quality assurance (CMC), the design of the proposed clinical studies, and the qualifications of the investigators due to carry out the study. The IND process is designed to enable regulators to assess whether a drug is safe to test in humans and has promise as a potential treatment. In Europe, a Clinical Trial Application (CTA) must be made to national regulatory agencies to secure approval for studies on humans.",https://revive.gardp.org/resource/investigational-new-drug-ind/
35,Discovery,Lead optimization,"Modifying the chemical characteristics of a molecule to maximize its antimicrobial activity and improve its pharmacological properties. Lead optimization builds on hit expansion, focusing on lead compounds with the most promising properties. Modifications focus on key areas such as strengthening binding to bacterial target molecules, minimizing binding to host structures, which could cause side effects, and ensuring its availability within target tissues in the body. Lead optimization generates one or more candidates for clinical evaluation.",https://revive.gardp.org/resource/lead-optimization/
36,Clinical,Marketing authorization application (MAA),"An application made to a European regulatory authority for approval to market a medicine within the European Union (or Iceland, Liechtenstein or Norway). An MAA includes comprehensive information about a drug to enable a regulatory authority to judge its quality, safety and efficacy.",https://revive.gardp.org/resource/marketing-authorization-application-maa/
37,Pre-clinical,Maximum tolerated dose (MTD),"The highest dose of a medicine or treatment that will produce the desired effect without resulting in unacceptable side effects. Higher concentrations of a drug are more likely to be effective but may induce side effects that deter use or outweigh the benefits of treatment. Maximum tolerated doses are usually determined in animal studies and provide the basis for choosing the range of drug concentrations tested in phase 1 trials (dose escalation).",https://revive.gardp.org/resource/maximum-tolerated-dose-mtd/
38,Discovery,Mechanism of action (MoA),"The specific biochemical interaction through which an antimicrobial produces its pharmacological effect. For antibiotics, the most common mechanisms of action are: Inhibition of cell wall synthesis Inhibition of protein synthesis Disruption of cell membranes Inhibition of DNA replication or transcription Inhibition of bacterial metabolism For compounds identified in phenotypic screens, mechanisms of action may not be immediately obvious. Further studies are required to understand how they achieve their antibacterial effects. Determining mechanism of action is important because it suggests what modifications could be made to a compound to improve its activity and specificity. In addition, antibiotics used as combinations should ideally have different mechanisms of actions, to make it harder for bacteria to develop resistance to treatment.",https://revive.gardp.org/resource/mechanism-of-action-moa/
39,Discovery,Medicinal chemistry,"The design, synthesis and modification of biologically active molecules. Medicinal chemistry plays a critical role in converting a newly discovered molecule with antibacterial activity (a hit) into a safe and effective candidate. Key steps include modifying the molecule to explore the relationship between chemical structure and antibacterial activity (structure-activity relationship, SAR) and adapting the molecule to improve its efficacy and drug-like properties (lead optimization).",https://revive.gardp.org/resource/medicinal-chemistry/
40,Discovery,Minimum inhibitory concentration (MIC),"The lowest concentration of an antibiotic that prevents the visible growth of bacteria. Potent antibiotics, therefore, have low MIC values. As bacteria become less susceptible to an antibiotic, MIC values increase. To categorize microbes as drug-resistant, the MIC values are compared with standardized recommended breakpoint concentrations.",https://revive.gardp.org/resource/minimal-inhibitory-concentration-mic/
41,Discovery,Multidrug-resistant (MDR),"Lack of susceptibility to at least one agent in three or more chemical classes of antibiotic (e.g. a beta-lactam, an aminoglycoside, a macrolide).",https://revive.gardp.org/resource/multidrug-resistant-mdr/
