id,category,skill,definition,definition_link
42,Discovery,Natural products,"Natural products are small molecules produced by living organisms including plants, invertebrates and microorganisms. They are also known as secondary metabolites being non-essential for life; but they play key roles in defence and cell to cell communication. They represent a unique chemical space with compounds distributed in a broad diversity of chemical classes. They have been evolving with nature together with the activities that have been optimized together with the targets. Pharmaceutical companies have been using natural products for decades as one of the major sources for discovery of novel bio-active compounds and today more than 50% of the molecules in development are still natural products, semi-synthetic derivatives or have been inspired in these scaffolds. Today, natural products are still an untapped reservoir with more than 90% of the microbial sources still underexplored and with biosynthetic potential that by far exceeds the initial estimations. This is why natural products still represent one of the major sources of chemical diversity and one of the starting points for the discovery of novel antibiotics.",https://revive.gardp.org/resource/natural-products/
43,Clinical,"New chemical entity (NCE), new molecular entity (NME)","A novel compound that has not previously been approved for use in humans. NCE (or new drug substance in the EU) is a formal definition used by regulatory authorities, designed to give protection to the developers of new drugs during clinical evaluation phases of drug development. More informally, NCE is used to describe a newly developed drug compound, as opposed to the re-use of an existing drug for a different disease, re-formulation of an existing drug, or a novel combination of existing drugs. Development of new antibiotic treatments depends both on the discovery and development of NCEs.",https://revive.gardp.org/resource/new-chemical-entity-nce-new-molecular-entity-nme/
44,Clinical,New drug application (NDA),"The formal process through which a company or other body requests permission from the US Food and Drug Administration (FDA) to make and sell a drug in the USA. In Europe, the equivalent process is known as a marketing authorization application (MAA).",https://revive.gardp.org/resource/new-drug-application-nda/
45,Clinical,Observational study,"A clinical study that is used to gather data but does not involve the testing of an intervention (e.g., new drug). Observational studies are used to collect varying kinds of information, such as the prevalence of an infection, cause of an infection, use of particular drugs in clinical settings, the characteristics of affected patients, the care procedures used, and clinical outcomes for normal standard of care. The information gathered is typically used to identify patient populations and suitable sites for trials, and to guide the design of interventional studies, which assess the impact of interventions such as new drugs. Observational studies can be used to generate evidence of the efficacy of treatments, for example through case–control designs (where outcomes in cases are compared with those in matched individuals). Evidence from observational studies is generally not seen as reliable as that from randomised controlled trials.",https://revive.gardp.org/resource/observational-study/
46,Clinical,Orphan drug,"A drug developed to treat a rare (“orphan”) disease. Many diseases are so rare that it is not economically viable for companies to invest in the development of new treatments. Collectively, however, orphan diseases are responsible for a significant burden of disease. Regulatory authorities therefore provide incentives to encourage therapy development for orphan diseases. To qualify for orphan drug status, a therapy must be targeted at a condition affecting fewer than 200,000 persons in the USA (about six in 10,000 people) or not more than five in 10,000 people in the EU. New antibiotics and other anti-infectives targeting rare but important infections can be granted orphan drug status (e.g. treatment of prosthetic joint infections, or treatment of lung infections in people with cystic fibrosis).",https://revive.gardp.org/resource/orphan-drug/
47,Clinical,Pandrug-resistant (PDR),"Non-susceptibility to all agents in all antimicrobial categories (i.e. bacterial isolates are not susceptible to any clinically available drug). The prevalence of PDR bacteria is difficult to judge as isolates are rarely assessed against all possible antibiotics. However, PDR Gram-negative bacteria have been reported in more than 20 countries in all regions of the world. Mortality in patients infected with these bacteria is high (around 50% on average) but very variable.",https://revive.gardp.org/resource/pandrug-resistant/
48,Pre-clinical,Pharmacodynamics (PD),"Study of the uptake, movement, binding and interactions of drugs in the body and how they affect drug activity. Drug activity depends on engagement between a drug and its molecular target. Any factor affecting drug concentration at its target site, strength of binding or duration of binding will affect that drug’s pharmacological activity and clinical responses. Broadly speaking, pharmacodynamics considers the properties of a drug that affect target engagement in the body, while pharmacokinetics considers the effect of the body on a drug.",https://revive.gardp.org/resource/pharmacodynamics-pd/
49,Pre-clinical,Pharmacokinetics (PK),"Study of the body’s handling and metabolism of drugs in the body, including their absorption, distribution between different tissues, localization within tissues, modification and excretion (see: ‘ADME‘). Drug activity depends on engagement between a drug and its molecular target. If the body does not absorb a drug, modifies it chemically, or rapidly excretes it, the drug will be less able to bind to its target site and have a biological effect. Broadly speaking, pharmacokinetics considers the effect of the body on a drug, while pharmacodynamics considers the properties of a drug that affect target engagement in the body. Population PK modelling takes account of variation in how drugs are metabolized by different people within a population. This requires more sophisticated statistical methodologies but provides results more relevant to individuals. Physiologically-based pharmacokinetic models are more closely based on human anatomy, physiology and biochemistry. They are complex multi-component models that more accurately reflect human biology but are also more challenging to develop.",https://revive.gardp.org/resource/pharmacokinetics-pk/
50,Pre-clinical,Pharmacokinetics-pharmacodynamics (PK/PD),"Integration of pharmacokinetic and pharmacodynamic data to understand how a drug is likely to be distributed through the body over time and the access it will have to its molecular target. This understanding provides the basis for dosing strategies. Typically, PK/PD modelling is used to simulate how a drug is distributed across different tissues (or ‘compartments’) over time. These models can be used to estimate drug concentrations at different body sites for different dosing regimens and drug effect.",https://revive.gardp.org/resource/pharmacokinetics-pharmacodynamics-pk-pd/
51,Clinical,Pharmacovigilance,"Clinical trials are used to assess the safety of new medicines. Pharmacovigilance is the process of collecting safety data after the drug has been approved for use and giving this information to the regulatory authorities. The data collected includes adverse effects associated with use of a drug. Pharmacovigilance is required after marketing approval to detect potential adverse reactions that could be due to use of the medicine. In particular, it can detect rare side effects that are not picked up during clinical trials or affect specific groups of individuals. A phase 4 clinical trial investigates the occurrence of side effects over time by a new treatment after it has been approved and is on the market.",https://revive.gardp.org/resource/pharmacovigilance/
52,Clinical,"Phase 1, 2, 3, 4 trials","Different stages of clinical testing of a new drug. Phase 1: First testing in humans, primarily to test safety. A drug is given to a small number of healthy volunteers who are closely monitored. Phase 2: Testing in a small number of patients, to assess safety, to monitor how a drug is metabolized, and to gather initial data on efficacy. Phase 3: A large trial in patients to test efficacy and safety. Pivotal phase 3 trials (or registration trials) provide the key data on efficacy in submissions for regulatory approval. Phase 4: Studies undertaken after a drug has been licensed, to gather further safety, efficacy or effectiveness data in routine clinical use. Phase 2 studies are sometimes divided into phase 2A and 2B. There are no formal definitions of these divisions, but phase 2A studies are typically more preliminary and can address issues such as dosing and safety, while phase 2B studies are generally ‘mini-phase 3’ studies that provide data on efficacy. Increasingly, these categories are becoming less clear-cut, particularly phase 2 and 3 trials.",https://revive.gardp.org/resource/phase-1234-trials/
53,Clinical,Pneumonia,"An infection of the lungs where the air sacs (alveoli) fill with fluid and pus making breathing difficult. Bacterial pneumonia can follow from an infection by respiratory viruses such as influenza. Community-acquired pneumonia (CAP) affects people outside hospital. Pneumonia can also occur in patients while in hospital (hospital-acquired pneumonia, HAP), particularly when patients are on mechanical ventilation (ventilator-associated pneumonia, VAP). Pneumonia can be caused by bacteria, viruses and fungi. The organisms causing bacterial community-acquired pneumonia are usually different to those responsible for hospital-acquired pneumonia.",https://revive.gardp.org/resource/pneumonia/
54,Clinical,Power (clinical trials),"The probability of detecting a true effect in an experimental study. Clinical trials involve a subset of a population of interest. Results are then extrapolated to the population of a whole. However, this raises the risk that the effects seen in the trial are not representative of those that would be seen in the whole population. This risk is greatest when sample sizes are small. Power analysis is used to provide a measure of confidence in results and to ensure the statistical validity of extrapolation to larger populations. Power analysis is a key element of study design, particularly to identify appropriate sample sizes (in clinical trials, how many people need to be recruited). As recruitment can be challenging, there is an incentive to minimize the number of participants in a study. However, with small numbers, it can be difficult to be confident that observed effects provide a reliable indication of an intervention’s effects. A second key factor affecting the power of a study and sample sizes is the effect size that indicates a clinically meaningful change and can be used to judge whether an intervention has demonstrated efficacy. Detecting a small change will require large numbers of participants to provide good statistical confidence. Power analyses are used to provide an estimate of the likelihood (expressed as a percentage) that a particular effect size will be seen for a particular sample size. In practice, preferred likelihoods and effect sizes are selected in order to identify appropriate sample sizes (e.g. a 95% probability of detecting a 20% decrease in an outcome measure of interest). If a study includes too few participants for statistically robust conclusions to be drawn, it is described as underpowered.",https://revive.gardp.org/resource/power-clinical-trials/
55,Pre-clinical,Preclinical development,"The preclinical phase of drug development refers to testing of activity and toxicity of a drug candidate in in vitro and in vivo studies before testing in patients can be performed. The preclinical development stage begins when a viable candidate for formal preclinical development has been chosen. The programme is informed by guidance documents issued by regulatory agencies and includes CMC, animal toxicology, pharmacological data, and clinical protocols and investigator information. The goal of preclinical development is to submit data for review to the regulatory agencies to approve clinical testing of the drug in humans.",https://revive.gardp.org/resource/preclinical-development/
56,Discovery,Pro-drug,"A drug that is administered in an inactive form and is metabolized in the body into a pharmacologically active agent. A pro-drug may be developed if a biologically active compound has poor pharmacokinetic properties, for example if it is not absorbed well or rapidly excreted.",https://revive.gardp.org/resource/pro-drug/
57,Clinical,QT study,"A clinical study to assess the potential of a drug to affect heart rhythms. Some drugs, including antibiotics, can lengthen the time it takes for the heart muscles to prepare for contraction, known as prolongation of the QT interval. The QT interval is a measurement made on an electrocardiogram. Because of this risk, regulatory authorities require that drug developers provide evidence of their drug’s impact on the QT interval.",https://revive.gardp.org/resource/qt-study/
58,Clinical,Quality assurance (clinical trials),"Measures taken to ensure that a clinical study is conducted and reported according to its agreed protocol, and in accordance with Good Clinical Practice and any other relevant regulatory requirements. Quality assurance is based on a planned and systematic set of activities to ensure that all aspects of a clinical trial are carried out to a high standard. These activities are essential to protect the health and wellbeing of participants in trials and to ensure that the data obtained are reliable.",https://revive.gardp.org/resource/quality-assurance-clinical-trials/
59,Clinical,Sepsis,"Life-threatening organ failure caused by a dysregulated host response, often to an infection. In informal use, sepsis often refers to a bloodstream bacterial infection (BSI), and the term is sometimes used synonymously with septicaemia. More than 19 million cases of sepsis and 5 million sepsis-related deaths are estimated to occur each year, most of them in low- and middle-income countries. Sepsis causes nearly half a million deaths in the newborn period each year. Globally, antimicrobial resistance contributes to one-third of neonatal sepsis deaths.",https://revive.gardp.org/resource/sepsis/
60,Clinical,Serious adverse event (SAE),"Any unfavourable occurrence in a trial participant that has a major impact on their health. All SAEs occurring during a trial must be documented in clinical study reports and whether they are considered related to participation in the trial. Independent investigations are carried out to determine whether the SAE was potentially related to the trial intervention or was a random occurrence. Suspected unexpected serious adverse reactions (SUSARs) are those considered likely to have been caused by the study intervention.",https://revive.gardp.org/resource/serious-adverse-event-sae/
61,Clinical,Skin and soft tissue infection (SSTI),"Microbial invasion of the layers of the skin and underlying soft tissues. The FDA defines acute bacterial skin and skin structure infection (ABSSSI) as a bacterial infection of the skin with a lesion size area of at least 75 cm2 (cellulitis, erysipelas, wound infection, major cutaneous abscess). The EMA classification of bacterial skin and soft tissue infection (BSSTI) includes cellulitis, erysipelas, wound infections (traumatic or post-surgical) and major abscesses. Complicated skin and soft tissue infections (cSSTI) are the most severe and involve deeper soft tissue. Staphylococcus aureus is the most common cause of cSSTIs, with methicillin-resistant S. aureus (MRSA) a particular challenge.",https://revive.gardp.org/resource/skin-and-soft-tissue-infection-ssti/
62,Discovery,Small molecule,"A chemical/antimicrobial with a mass usually less than 1000 daltons. Small molecules have long been the preferred type of pharmaceutical. Their advantages include relative ease of chemical manufacture, pharmacologic predictability, ability to enter cells and potential for oral use.",https://revive.gardp.org/resource/small-molecule/
63,Pre-clinical,Target candidate profile (TCP),"The desired characteristics of a preclinical drug candidate. A TCP covers key features such as antimicrobial activity, specificity, stability and physicochemical properties. It is used during early research and development (R&D) phases to select the best compounds to work on and to guide optimization of chemical structures and properties through medicinal chemistry.",https://revive.gardp.org/resource/target-candidate-profile-tcp/
64,Pre-clinical,Target product profile (TPP),"The desired characteristics of a new drug or other medical intervention (such as a diagnostic tool). TPPs include key factors such as nature of infection, age group, clinical efficacy, safety and tolerability, stability, route of administration, dosing frequency and cost. They are often developed by the World Health Organization (WHO) or other bodies to provide a global consensus on the requirements of a new drug or medical intervention, to guide research and development (R&D) activities.",https://revive.gardp.org/resource/target-product-profile-tpp/
65,Discovery,Target validation,"Confirmation that inhibition of a bacterial target structure or enzymatic activity is likely to be clinically useful. A bacterial target is critical to its survival or multiplication. However, it must be shown in vitro or in animal models that inhibition of the target is pharmacologically possible and impairs microbial growth, that it cannot be readily overcome by adaptation of other microbial pathways, and that has no significant impact on the host. Stage of infection must also be considered. A bacterial protein important in late stages of infection, when the host has already been infected, may be a less promising target than one essential to an early stage of infection.",https://revive.gardp.org/resource/target-validation/
66,Clinical,Therapeutic index,"The ratio of the blood concentration at which a drug becomes toxic (TD50) and the concentration at which it is effective (ED50). Dosage of drugs with a low therapeutic index can be challenging, as relatively small increases in drug levels can trigger side effects. Such drugs are said to have a small therapeutic window.",https://revive.gardp.org/resource/therapeutic-index/
67,Pre-clinical,Toxicity,"The harmful effects of a drug. Toxicity is one of the most common reasons for a drug to fail during clinical development. Toxicology studies traditionally focused on the effects of a drug in animal models, but increasingly in vitro cellular and biochemical approaches are also being used. To a degree, potential toxicity issues can now also be predicted on the basis of chemical structures (‘in silico toxicology’).",https://revive.gardp.org/resource/toxicity/
68,Clinical,Urinary tract infection (UTI),"An infection in any part of the urinary system (kidney, ureter, bladder or urethra). UTIs, particularly by E. coli in women, are extremely common. Widespread use of antibiotics has led to high levels of drug-resistant bacteria that cause UTIs, many caused by bacteria carrying extended-spectrum beta-lactamases (ESBLs). Complicated UTIs (cUTIs) are usually in people with underlying conditions, for example structural or functional abnormalities in the urinary system, other underlying health issues, or the impact of medical interventions such as use of catheters. Most UTIs in older people are cUTIs. cUTIs increase the risk of treatment failure, complications and antibiotic resistance.",https://revive.gardp.org/resource/urinary-tract-infection-uti/
69,Clinical,Ventilator-associated pneumonia (VAP),"A lung infection that develops in a patient who is on a ventilator. VAP is the most common infection acquired in intensive care units and is associated with high mortality. It can be caused by multiple microbes, and the need to treat rapidly leads to use of broad-spectrum antibiotics. Treatment is increasingly difficult in many settings due to drug-resistant infections, particularly multidrug-resistant Acinetobacter baumannii and other ‘ESKAPE’ pathogens. The organisms responsible for VAP are generally different from those causing pneumonia outside the hospital (community-acquired pneumonia).",https://revive.gardp.org/resource/ventilator-associated-pneumonia-vap/
